{
  "$schema": "https://raw.githubusercontent.com/labscommunity/intelinside/main/results/schema.json",
  "rig": "1",
  "component": "intel-arc-pro-b70",
  "componentQuantity": 1,
  "model": "qwen3-8-27b",
  "quant": "exl3-4bpw",
  "runtime": "exl3xpu",
  "runtimeVersion": "turboderp 113cf7ab; image ghcr.io/0xsero/exl3xpu@sha256:21412bdd",
  "runtimeFlags": "fp8 KV, MTP3 speculative, prefix caching on, gmu 0.90, ZE_AFFINITY_MASK single card",
  "decodeTps": 17.1,
  "promptTps": 1680,
  "ttftMs": 440,
  "contextLength": 65536,
  "batchSize": 1,
  "runDate": "2026-09-27",
  "notes": "Dense 27B on one Arc Pro B70. C1 decode = client-measured post-first-token stream rate, median of 9-10 measured samples at p512/g128 (15.8-19.1; p8192/g128 median 15.8); engine runs native MTP3 so this is a conservative lower bound on emitted tokens. Cold 8K prefill ~1,870 tok/s client-side. 150 W cap. Correctness: arithmetic canary PASS (sum i*i, i<4 -> 14), 8/10 executable-task battery. Capacity: the only measured single-B70 route holding the model's native 262,144-token context (fp8 KV pool ~287K tokens); a 261,920-token prompt was answered correctly. Functional codegen caveat: interactive-web battery 2/3 on the hard round (GLSL syntax error on raw WebGL2 prompt). Self-reported, E2.",
  "evidenceUrl": "https://github.com/SergiioB/intel-arc-pro-b70-inference-cookbook/blob/master/docs/qwen38-27b/EXL3-XPU.md"
}
