{
  "$schema": "https://raw.githubusercontent.com/labscommunity/intelinside/main/results/schema.json",
  "rig": "9",
  "component": "intel-arc-pro-b70",
  "componentQuantity": 1,
  "model": "nemotron-3-5-lightning-30b-a3b",
  "quant": "q4_k_m",
  "runtime": "llamacpp",
  "runtimeVersion": "version: 0.5.0-dev (build 1, commit 526c43b)",
  "runtimeFlags": "llama.cpp Vulkan backend, -ngl 99 (all layers on GPU), ctx 4096, batch 1",
  "decodeTps": 102.8,
  "promptTps": 119.5,
  "ttftMs": 261.2,
  "contextLength": 159,
  "batchSize": 1,
  "runDate": "2026-09-29",
  "notes": "ReBAR on, 32GB BAR. 3 runs: decode 106.4/98.0/104.1. Unsloth UD-Q4_K_M GGUF (25.27GB). Mamba-MoE hybrid, fully GPU-resident. llama-bench tg128 cross-check: 107.9."
}
