{
  "$schema": "https://raw.githubusercontent.com/labscommunity/intelinside/main/results/schema.json",
  "rig": "9",
  "component": "intel-arc-pro-b70",
  "componentQuantity": 1,
  "model": "medgemma-4b-it",
  "quant": "q4_k_m",
  "runtime": "llamacpp",
  "runtimeVersion": "version: 0.5.0-dev (build 1, commit 526c43b)",
  "runtimeFlags": "llama.cpp Vulkan backend, -ngl 99 (all layers on GPU), ctx 4096, batch 1, --ignore-eos, text-only",
  "decodeTps": 86.0,
  "promptTps": 154.5,
  "ttftMs": 149.2,
  "contextLength": 151,
  "batchSize": 1,
  "runDate": "2026-09-30",
  "notes": "ReBAR on, 32GB BAR. 3 runs: decode 86.7/86.1/85.2. Unsloth Q4_K_M GGUF (2.49GB), text-only (multimodal model). --ignore-eos for full 128 tokens. llama-bench tg128 cross-check: 86.1."
}
