{
  "$schema": "https://raw.githubusercontent.com/labscommunity/intelinside/main/results/schema.json",
  "rig": "9",
  "component": "intel-arc-pro-b70",
  "componentQuantity": 1,
  "model": "mistral-small-3-2-24b",
  "quant": "q4_k_m",
  "runtime": "llamacpp",
  "runtimeVersion": "version: 0.5.0-dev (build 1, commit 526c43b)",
  "runtimeFlags": "llama.cpp Vulkan backend, -ngl 99 (all layers on GPU), ctx 4096, batch 1, --ignore-eos",
  "decodeTps": 33.4,
  "promptTps": 646.2,
  "ttftMs": 885.3,
  "contextLength": 700,
  "batchSize": 1,
  "runDate": "2026-09-30",
  "notes": "ReBAR on, 32GB BAR. 3 runs, identical decode_tps. Unsloth Q4_K_M GGUF (14.33GB). --ignore-eos for full 128 tokens (stops at 42 otherwise); 572-token prompt (template-heavy). llama-bench tg128 cross-check: 34.0."
}
